{
  "machine_profile": "UniMac - Pulse Activated",
  "manufacturer": "UniMac",
  "model": "Pulse Activated",
  "activation": "credit_pulse",
  "default_duration_seconds": 0.1,
  "default_gap_seconds": 0.1,
  "default_pulses_per_vend": 1,
  "default_active_high": true,
  "channel": "credit-pulse",
  "status": "field_candidate",
  "brands": ["UniMac", "Alliance Laundry Systems"],
  "aliases": ["unimac-pulse"],
  "notes": "Alliance commercial brand commonly installed with coin-pulse / start-pulse payment readers. Timing taken from PayRange Alliance harness table (100 ms).",
  "sources": [
    {
      "title": "PayRange BluKey Method 1 brands include UniMac",
      "url": "https://payrange.com/for_download/manuals/PayRange-Laundry-Resources/Laundry-Installation-Guides/Laundrylux/BkPro-RelayModule-HV_LV-PN-11.02043-xx.pdf"
    }
  ]
}
